{"m2leanVersion":"0.2.0","documentId":"example-polynomial","objects":[{"id":"k1","kind":"RationalField"},{"id":"R2","kind":"PolynomialRing","coefficients":"k1","variables":["x","y"],"monomialOrder":{"kind":"GRevLex"}},{"id":"I3","kind":"Ideal","ring":"R2","generators":[{"terms":[{"coefficient":{"num":"1","den":"1"},"exponents":[1,0]},{"coefficient":{"num":"1","den":"1"},"exponents":[0,1]}]},{"terms":[{"coefficient":{"num":"1","den":"1"},"exponents":[1,0]},{"coefficient":{"num":"-1","den":"1"},"exponents":[0,1]}]}]},{"id":"I4","kind":"Ideal","ring":"R2","generators":[{"terms":[{"coefficient":{"num":"1","den":"1"},"exponents":[1,0]}]},{"terms":[{"coefficient":{"num":"1","den":"1"},"exponents":[0,1]}]}]}],"claims":[{"id":"id1","kind":"PolynomialIdentity","ring":"R2","lhs":{"terms":[{"coefficient":{"num":"1","den":"1"},"exponents":[2,0]},{"coefficient":{"num":"2","den":"1"},"exponents":[1,1]},{"coefficient":{"num":"1","den":"1"},"exponents":[0,2]}]},"rhs":{"terms":[{"coefficient":{"num":"1","den":"1"},"exponents":[2,0]},{"coefficient":{"num":"2","den":"1"},"exponents":[1,1]},{"coefficient":{"num":"1","den":"1"},"exponents":[0,2]}]},"evidence":{}},{"id":"mem1","kind":"IdealMembership","ideal":"I3","element":{"terms":[{"coefficient":{"num":"1","den":"1"},"exponents":[3,0]},{"coefficient":{"num":"1","den":"1"},"exponents":[0,3]}]},"evidence":{"cofactors":[{"terms":[{"coefficient":{"num":"1","den":"2"},"exponents":[2,0]},{"coefficient":{"num":"1","den":"2"},"exponents":[0,2]}]},{"terms":[{"coefficient":{"num":"1","den":"2"},"exponents":[2,0]},{"coefficient":{"num":"-1","den":"2"},"exponents":[0,2]}]}]}},{"id":"inc1","kind":"SpanInclusion","source":"I3","target":"I4","evidence":{"cofactorRows":[[{"terms":[{"coefficient":{"num":"1","den":"1"},"exponents":[0,0]}]},{"terms":[{"coefficient":{"num":"1","den":"1"},"exponents":[0,0]}]}],[{"terms":[{"coefficient":{"num":"1","den":"1"},"exponents":[0,0]}]},{"terms":[{"coefficient":{"num":"-1","den":"1"},"exponents":[0,0]}]}]]}},{"id":"inc2","kind":"SpanInclusion","source":"I4","target":"I3","evidence":{"cofactorRows":[[{"terms":[{"coefficient":{"num":"1","den":"2"},"exponents":[0,0]}]},{"terms":[{"coefficient":{"num":"1","den":"2"},"exponents":[0,0]}]}],[{"terms":[{"coefficient":{"num":"1","den":"2"},"exponents":[0,0]}]},{"terms":[{"coefficient":{"num":"-1","den":"2"},"exponents":[0,0]}]}]]}}],"provenance":{"producer":"Macaulay2","producerVersion":"1.24.11","packageVersion":"0.2.0","algorithm":"gb (engine default)","options":{},"deterministic":true}}
