{"m2leanVersion":"0.2.0","documentId":"appendix-primefield","objects":[{"id":"k1","kind":"PrimeField","characteristic":"101"},{"id":"R2","kind":"PolynomialRing","coefficients":"k1","variables":["x","y"],"monomialOrder":{"kind":"GRevLex"}},{"id":"I3","kind":"Ideal","ring":"R2","generators":[{"terms":[{"coefficient":"1","exponents":[2,0]},{"coefficient":"1","exponents":[0,2]}]},{"terms":[{"coefficient":"1","exponents":[1,1]},{"coefficient":"100","exponents":[0,0]}]}]}],"claims":[{"id":"gbp","kind":"GroebnerBasis","ideal":"I3","basis":[{"terms":[{"coefficient":"1","exponents":[1,1]},{"coefficient":"100","exponents":[0,0]}]},{"terms":[{"coefficient":"1","exponents":[2,0]},{"coefficient":"1","exponents":[0,2]}]},{"terms":[{"coefficient":"1","exponents":[0,3]},{"coefficient":"1","exponents":[1,0]}]}],"evidence":{"basisCofactors":[[{"terms":[]},{"terms":[{"coefficient":"1","exponents":[0,0]}]}],[{"terms":[{"coefficient":"1","exponents":[0,0]}]},{"terms":[]}],[{"terms":[{"coefficient":"1","exponents":[0,1]}]},{"terms":[{"coefficient":"100","exponents":[1,0]}]}]],"generatorCofactors":[[{"terms":[]},{"terms":[{"coefficient":"1","exponents":[0,0]}]},{"terms":[]}],[{"terms":[{"coefficient":"1","exponents":[0,0]}]},{"terms":[]},{"terms":[]}]],"sPairs":[{"i":0,"j":1,"quotients":[{"terms":[]},{"terms":[]},{"terms":[{"coefficient":"100","exponents":[0,0]}]}]},{"i":0,"j":2,"quotients":[{"terms":[]},{"terms":[{"coefficient":"100","exponents":[0,0]}]},{"terms":[]}]},{"i":1,"j":2,"quotients":[{"terms":[]},{"terms":[{"coefficient":"100","exponents":[1,0]}]},{"terms":[{"coefficient":"1","exponents":[0,2]}]}]}]}},{"id":"memp","kind":"IdealMembership","ideal":"I3","element":{"terms":[{"coefficient":"1","exponents":[3,0]},{"coefficient":"1","exponents":[1,2]}]},"evidence":{"cofactors":[{"terms":[{"coefficient":"1","exponents":[1,0]}]},{"terms":[]}]}},{"id":"nmp","kind":"NonMembership","ideal":"I3","groebnerClaim":"gbp","element":{"terms":[{"coefficient":"1","exponents":[1,0]}]},"evidence":{"quotients":[{"terms":[]},{"terms":[]},{"terms":[]}],"remainder":{"terms":[{"coefficient":"1","exponents":[1,0]}]}}}],"provenance":{"producer":"Macaulay2","producerVersion":"1.24.11","packageVersion":"0.2.0","algorithm":"gb (engine default)","options":{},"deterministic":true}}
