{"m2leanVersion":"0.2.0","documentId":"appendix-stanley-reisner","objects":[{"id":"k1","kind":"RationalField"},{"id":"R2","kind":"PolynomialRing","coefficients":"k1","variables":["a","b","c","d"],"monomialOrder":{"kind":"GRevLex"}},{"id":"F3","kind":"GradedFreeModule","ring":"R2","degrees":[0]},{"id":"F4","kind":"GradedFreeModule","ring":"R2","degrees":[2,2]},{"id":"F5","kind":"GradedFreeModule","ring":"R2","degrees":[4]},{"id":"d6","kind":"Matrix","ring":"R2","rows":1,"cols":2,"entries":[[{"terms":[{"coefficient":{"num":"1","den":"1"},"exponents":[1,0,1,0]}]},{"terms":[{"coefficient":{"num":"1","den":"1"},"exponents":[0,1,0,1]}]}]]},{"id":"d7","kind":"Matrix","ring":"R2","rows":2,"cols":1,"entries":[[{"terms":[{"coefficient":{"num":"-1","den":"1"},"exponents":[0,1,0,1]}]}],[{"terms":[{"coefficient":{"num":"1","den":"1"},"exponents":[1,0,1,0]}]}]]}],"claims":[{"id":"koszul","kind":"GradedComplex","ring":"R2","modules":["F3","F4","F5"],"differentials":["d6","d7"],"evidence":{}},{"id":"koszulcx","kind":"ChainComplex","ring":"R2","differentials":["d6","d7"],"evidence":{}}],"provenance":{"producer":"Macaulay2","producerVersion":"1.24.11","packageVersion":"0.2.0","algorithm":"gb (engine default)","options":{},"deterministic":true}}
