{"m2leanVersion":"0.2.0","documentId":"wheel5-not-3-colourable","objects":[{"id":"k1","kind":"RationalField"},{"id":"R2","kind":"PolynomialRing","coefficients":"k1","variables":["x_1","x_2","x_3","x_4","x_5","x_6"],"monomialOrder":{"kind":"GRevLex"}},{"id":"I3","kind":"Ideal","ring":"R2","generators":[{"terms":[{"coefficient":{"num":"1","den":"1"},"exponents":[3,0,0,0,0,0]},{"coefficient":{"num":"-1","den":"1"},"exponents":[0,0,0,0,0,0]}]},{"terms":[{"coefficient":{"num":"1","den":"1"},"exponents":[0,3,0,0,0,0]},{"coefficient":{"num":"-1","den":"1"},"exponents":[0,0,0,0,0,0]}]},{"terms":[{"coefficient":{"num":"1","den":"1"},"exponents":[0,0,3,0,0,0]},{"coefficient":{"num":"-1","den":"1"},"exponents":[0,0,0,0,0,0]}]},{"terms":[{"coefficient":{"num":"1","den":"1"},"exponents":[0,0,0,3,0,0]},{"coefficient":{"num":"-1","den":"1"},"exponents":[0,0,0,0,0,0]}]},{"terms":[{"coefficient":{"num":"1","den":"1"},"exponents":[0,0,0,0,3,0]},{"coefficient":{"num":"-1","den":"1"},"exponents":[0,0,0,0,0,0]}]},{"terms":[{"coefficient":{"num":"1","den":"1"},"exponents":[0,0,0,0,0,3]},{"coefficient":{"num":"-1","den":"1"},"exponents":[0,0,0,0,0,0]}]},{"terms":[{"coefficient":{"num":"1","den":"1"},"exponents":[2,0,0,0,0,0]},{"coefficient":{"num":"1","den":"1"},"exponents":[1,1,0,0,0,0]},{"coefficient":{"num":"1","den":"1"},"exponents":[0,2,0,0,0,0]}]},{"terms":[{"coefficient":{"num":"1","den":"1"},"exponents":[0,2,0,0,0,0]},{"coefficient":{"num":"1","den":"1"},"exponents":[0,1,1,0,0,0]},{"coefficient":{"num":"1","den":"1"},"exponents":[0,0,2,0,0,0]}]},{"terms":[{"coefficient":{"num":"1","den":"1"},"exponents":[0,0,2,0,0,0]},{"coefficient":{"num":"1","den":"1"},"exponents":[0,0,1,1,0,0]},{"coefficient":{"num":"1","den":"1"},"exponents":[0,0,0,2,0,0]}]},{"terms":[{"coefficient":{"num":"1","den":"1"},"exponents":[0,0,0,2,0,0]},{"coefficient":{"num":"1","den":"1"},"exponents":[0,0,0,1,1,0]},{"coefficient":{"num":"1","den":"1"},"exponents":[0,0,0,0,2,0]}]},{"terms":[{"coefficient":{"num":"1","den":"1"},"exponents":[2,0,0,0,0,0]},{"coefficient":{"num":"1","den":"1"},"exponents":[1,0,0,0,1,0]},{"coefficient":{"num":"1","den":"1"},"exponents":[0,0,0,0,2,0]}]},{"terms":[{"coefficient":{"num":"1","den":"1"},"exponents":[2,0,0,0,0,0]},{"coefficient":{"num":"1","den":"1"},"exponents":[1,0,0,0,0,1]},{"coefficient":{"num":"1","den":"1"},"exponents":[0,0,0,0,0,2]}]},{"terms":[{"coefficient":{"num":"1","den":"1"},"exponents":[0,2,0,0,0,0]},{"coefficient":{"num":"1","den":"1"},"exponents":[0,1,0,0,0,1]},{"coefficient":{"num":"1","den":"1"},"exponents":[0,0,0,0,0,2]}]},{"terms":[{"coefficient":{"num":"1","den":"1"},"exponents":[0,0,2,0,0,0]},{"coefficient":{"num":"1","den":"1"},"exponents":[0,0,1,0,0,1]},{"coefficient":{"num":"1","den":"1"},"exponents":[0,0,0,0,0,2]}]},{"terms":[{"coefficient":{"num":"1","den":"1"},"exponents":[0,0,0,2,0,0]},{"coefficient":{"num":"1","den":"1"},"exponents":[0,0,0,1,0,1]},{"coefficient":{"num":"1","den":"1"},"exponents":[0,0,0,0,0,2]}]},{"terms":[{"coefficient":{"num":"1","den":"1"},"exponents":[0,0,0,0,2,0]},{"coefficient":{"num":"1","den":"1"},"exponents":[0,0,0,0,1,1]},{"coefficient":{"num":"1","den":"1"},"exponents":[0,0,0,0,0,2]}]}]}],"claims":[{"id":"not3col","kind":"IdealMembership","ideal":"I3","element":{"terms":[{"coefficient":{"num":"1","den":"1"},"exponents":[0,0,0,0,0,0]}]},"evidence":{"cofactors":[{"terms":[]},{"terms":[]},{"terms":[]},{"terms":[]},{"terms":[]},{"terms":[{"coefficient":{"num":"2","den":"1"},"exponents":[0,0,0,0,1,2]},{"coefficient":{"num":"-1","den":"1"},"exponents":[0,0,0,0,0,0]}]},{"terms":[{"coefficient":{"num":"2","den":"9"},"exponents":[0,0,1,0,1,2]},{"coefficient":{"num":"4","den":"9"},"exponents":[0,0,1,0,0,3]},{"coefficient":{"num":"-2","den":"9"},"exponents":[0,0,0,0,1,3]},{"coefficient":{"num":"-4","den":"9"},"exponents":[0,0,0,0,0,4]},{"coefficient":{"num":"-1","den":"3"},"exponents":[0,0,1,0,0,0]},{"coefficient":{"num":"1","den":"3"},"exponents":[0,0,0,0,0,1]}]},{"terms":[{"coefficient":{"num":"-2","den":"9"},"exponents":[1,0,0,0,1,2]},{"coefficient":{"num":"-4","den":"9"},"exponents":[1,0,0,0,0,3]},{"coefficient":{"num":"2","den":"9"},"exponents":[0,0,0,0,1,3]},{"coefficient":{"num":"4","den":"9"},"exponents":[0,0,0,0,0,4]},{"coefficient":{"num":"1","den":"3"},"exponents":[1,0,0,0,0,0]},{"coefficient":{"num":"-1","den":"3"},"exponents":[0,0,0,0,0,1]}]},{"terms":[{"coefficient":{"num":"2","den":"9"},"exponents":[0,0,0,0,2,2]},{"coefficient":{"num":"2","den":"9"},"exponents":[0,0,0,0,1,3]},{"coefficient":{"num":"-4","den":"9"},"exponents":[0,0,0,0,0,4]},{"coefficient":{"num":"-1","den":"3"},"exponents":[0,0,0,0,1,0]},{"coefficient":{"num":"1","den":"3"},"exponents":[0,0,0,0,0,1]}]},{"terms":[{"coefficient":{"num":"-2","den":"9"},"exponents":[0,0,1,0,1,2]},{"coefficient":{"num":"-4","den":"9"},"exponents":[0,0,1,0,0,3]},{"coefficient":{"num":"2","den":"9"},"exponents":[0,0,0,0,1,3]},{"coefficient":{"num":"4","den":"9"},"exponents":[0,0,0,0,0,4]},{"coefficient":{"num":"1","den":"3"},"exponents":[0,0,1,0,0,0]},{"coefficient":{"num":"-1","den":"3"},"exponents":[0,0,0,0,0,1]}]},{"terms":[{"coefficient":{"num":"2","den":"9"},"exponents":[0,0,0,0,2,2]},{"coefficient":{"num":"8","den":"9"},"exponents":[0,0,0,0,1,3]},{"coefficient":{"num":"8","den":"9"},"exponents":[0,0,0,0,0,4]},{"coefficient":{"num":"-1","den":"3"},"exponents":[0,0,0,0,1,0]},{"coefficient":{"num":"-2","den":"3"},"exponents":[0,0,0,0,0,1]}]},{"terms":[{"coefficient":{"num":"-2","den":"9"},"exponents":[0,0,1,0,1,2]},{"coefficient":{"num":"-2","den":"9"},"exponents":[0,0,0,0,2,2]},{"coefficient":{"num":"-4","den":"9"},"exponents":[0,0,1,0,0,3]},{"coefficient":{"num":"-2","den":"3"},"exponents":[0,0,0,0,1,3]},{"coefficient":{"num":"-4","den":"9"},"exponents":[0,0,0,0,0,4]},{"coefficient":{"num":"1","den":"3"},"exponents":[0,0,1,0,0,0]},{"coefficient":{"num":"1","den":"3"},"exponents":[0,0,0,0,1,0]},{"coefficient":{"num":"1","den":"3"},"exponents":[0,0,0,0,0,1]}]},{"terms":[{"coefficient":{"num":"2","den":"9"},"exponents":[1,0,0,0,1,2]},{"coefficient":{"num":"-2","den":"9"},"exponents":[0,0,1,0,1,2]},{"coefficient":{"num":"4","den":"9"},"exponents":[1,0,0,0,0,3]},{"coefficient":{"num":"-4","den":"9"},"exponents":[0,0,1,0,0,3]},{"coefficient":{"num":"-1","den":"3"},"exponents":[1,0,0,0,0,0]},{"coefficient":{"num":"1","den":"3"},"exponents":[0,0,1,0,0,0]}]},{"terms":[{"coefficient":{"num":"2","den":"9"},"exponents":[1,0,0,0,1,2]},{"coefficient":{"num":"-2","den":"9"},"exponents":[0,0,0,0,2,2]},{"coefficient":{"num":"4","den":"9"},"exponents":[1,0,0,0,0,3]},{"coefficient":{"num":"-4","den":"9"},"exponents":[0,0,0,0,1,3]},{"coefficient":{"num":"-1","den":"3"},"exponents":[1,0,0,0,0,0]},{"coefficient":{"num":"1","den":"3"},"exponents":[0,0,0,0,1,0]}]},{"terms":[{"coefficient":{"num":"2","den":"9"},"exponents":[0,0,1,0,1,2]},{"coefficient":{"num":"-2","den":"9"},"exponents":[0,0,0,0,2,2]},{"coefficient":{"num":"4","den":"9"},"exponents":[0,0,1,0,0,3]},{"coefficient":{"num":"-4","den":"9"},"exponents":[0,0,0,0,1,3]},{"coefficient":{"num":"-1","den":"3"},"exponents":[0,0,1,0,0,0]},{"coefficient":{"num":"1","den":"3"},"exponents":[0,0,0,0,1,0]}]},{"terms":[{"coefficient":{"num":"-2","den":"9"},"exponents":[1,0,0,0,1,2]},{"coefficient":{"num":"2","den":"9"},"exponents":[0,0,1,0,1,2]},{"coefficient":{"num":"-2","den":"9"},"exponents":[0,0,0,0,2,2]},{"coefficient":{"num":"-4","den":"9"},"exponents":[1,0,0,0,0,3]},{"coefficient":{"num":"4","den":"9"},"exponents":[0,0,1,0,0,3]},{"coefficient":{"num":"-8","den":"9"},"exponents":[0,0,0,0,1,3]},{"coefficient":{"num":"4","den":"9"},"exponents":[0,0,0,0,0,4]},{"coefficient":{"num":"1","den":"3"},"exponents":[1,0,0,0,0,0]},{"coefficient":{"num":"-1","den":"3"},"exponents":[0,0,1,0,0,0]},{"coefficient":{"num":"1","den":"3"},"exponents":[0,0,0,0,1,0]},{"coefficient":{"num":"2","den":"3"},"exponents":[0,0,0,0,0,1]}]}]}}],"provenance":{"producer":"Macaulay2","producerVersion":"1.24.11","packageVersion":"0.2.0","algorithm":"gb (engine default)","options":{},"deterministic":true}}
