{
  "m2leanVersion": "0.2.0",
  "documentId": "fixture-nondeterministic-provenance",
  "objects": [
    { "id": "QQ", "kind": "RationalField" },
    { "id": "R", "kind": "PolynomialRing", "coefficients": "QQ",
      "variables": ["x"], "monomialOrder": { "kind": "GRevLex" } }
  ],
  "claims": [
    {
      "id": "id", "kind": "PolynomialIdentity", "ring": "R",
      "lhs": { "terms": [
        { "coefficient": { "num": "1", "den": "1" }, "exponents": [1] }
      ] },
      "rhs": { "terms": [
        { "coefficient": { "num": "1", "den": "1" }, "exponents": [1] }
      ] },
      "evidence": {}
    }
  ],
  "provenance": {
    "producer": "handwritten", "producerVersion": "n/a",
    "packageVersion": "0.2.0", "algorithm": "randomized search",
    "options": { "seed": "unrecorded" }, "deterministic": false
  }
}
